{"canonical_writes":0,"catalog_digest":"sha256:85c31b3f66be88efe213e122d4616c697ab3806a6466064875d011407fb6d131","created_utc":"2026-07-28T00:00:00Z","features":["mean","variance","autocorr_lag1"],"grants_authority":false,"metrics":[{"name":"effect_size","tolerance_decimal":"0.01"},{"name":"rmse","tolerance_decimal":"0.001"}],"null_generators":[{"kind":"phase_randomized","seed":17},{"kind":"block_bootstrap","seed":23}],"output_schemas":["EvidenceAssessment"],"pack_digests":["sha256:a4a783491c93c4ba74489ba7c0d86d14c073ccf5df3ff68d962d53323108e922","sha256:c4b3459cb8af668d09935cf297ced3da5f179a1769a40d2457caead06f981fb9"],"pilot_id":"sha256:7dd6dc35637bd239b30dfdba17acba32d8ae8047f3d794bf50b79039d589e388","policy_digest":"sha256:054934ca9f299a6e2582754a3a1782fb4733c53d099f85956366630282096fe2","preprocessing_scope":"demean;first_difference","prospective_holdout_materialization_allowed":false,"retrospective_window":{"end_utc":"2026-06-30T00:00:00Z","split_rule":"chronological_80_20","start_utc":"2026-01-01T00:00:00Z"},"schema_version":"PilotSpec/v1","seed_policy":{"seed":42,"threads":2},"source_artifact_digests":["sha256:bb04bec2a80c9af30ad62d98526dd8b22d264acac4f9b910a50e1bafc2009756","sha256:22306d996ce6af7e0a5cc6d5b169e1005f2c1235c64ed276e8241ceda21508c1"],"status_promotion_allowed":false}
